{
  "schemaVersion": "djtt.mft.config-export.v1",
  "capturedAt": "2026-01-01T00:00:00.000Z",
  "device": {
    "manufacturer": "DJ TechTools",
    "manufacturerId": [
      0,
      1,
      121
    ],
    "familyId": 5,
    "modelId": 1,
    "firmware": {
      "date": "2026-07-02",
      "identityBytes": [
        32,
        38,
        7,
        2
      ]
    },
    "unitId": {
      "source": "sysex-0x05",
      "hex": "0000000000000000"
    },
    "midiPorts": {
      "input": "Synthetic Twister",
      "output": "Synthetic Twister"
    }
  },
  "capabilities": {
    "bankCount": 4,
    "encodersPerBank": 16
  },
  "globals": {
    "midiChannel": 1,
    "sideButtonsBanked": false,
    "sideButtons": [
      {
        "number": 1,
        "action": {
          "code": 0,
          "name": "ccHold"
        }
      },
      {
        "number": 2,
        "action": {
          "code": 0,
          "name": "ccHold"
        }
      },
      {
        "number": 3,
        "action": {
          "code": 0,
          "name": "ccHold"
        }
      },
      {
        "number": 4,
        "action": {
          "code": 0,
          "name": "ccHold"
        }
      },
      {
        "number": 5,
        "action": {
          "code": 0,
          "name": "ccHold"
        }
      },
      {
        "number": 6,
        "action": {
          "code": 0,
          "name": "ccHold"
        }
      }
    ],
    "superKnob": {
      "start": 0,
      "end": 127
    },
    "brightness": {
      "rgb": 127,
      "indicator": 127
    },
    "colorMap": {
      "code": 0,
      "name": "classic"
    },
    "animationChannels": {
      "encoder": 1,
      "switch": 1
    },
    "sleep": {
      "timeoutIndex": 0,
      "timeoutMinutes": 0,
      "animation": {
        "code": 0,
        "name": "lightsOff"
      }
    },
    "bankAnimationsEnabled": true,
    "rawTags": {
      "0": 1,
      "1": 0,
      "2": 0,
      "3": 0,
      "4": 0,
      "5": 0,
      "6": 0,
      "7": 0,
      "8": 0,
      "9": 127,
      "31": 127,
      "32": 127,
      "33": 0,
      "34": 1,
      "35": 1,
      "36": 0,
      "37": 0,
      "38": 1
    }
  },
  "banks": [
    {
      "number": 1,
      "encoders": [
        {
          "number": 1,
          "detent": {
            "enabled": false,
            "color": 64
          },
          "movement": {
            "code": 0,
            "name": "direct"
          },
          "switch": {
            "action": {
              "code": 0,
              "name": "ccHold"
            },
            "midiChannel": 1,
            "midiNumber": 0
          },
          "encoder": {
            "midiChannel": 1,
            "shiftedMidiChannel": 1,
            "midiNumber": 0,
            "type": {
              "code": 0,
              "name": "note"
            }
          },
          "colors": {
            "active": 43,
            "inactive": 0
          },
          "indicator": {
            "code": 0,
            "name": "dot"
          },
          "superKnobEnabled": false,
          "rawTags": {
            "10": 0,
            "11": 0,
            "12": 0,
            "13": 1,
            "14": 0,
            "15": 0,
            "16": 1,
            "17": 0,
            "18": 0,
            "19": 43,
            "20": 0,
            "21": 64,
            "22": 0,
            "23": 0,
            "24": 1
          }
        },
        {
          "number": 2,
          "detent": {
            "enabled": false,
            "color": 64
          },
          "movement": {
            "code": 0,
            "name": "direct"
          },
          "switch": {
            "action": {
              "code": 0,
              "name": "ccHold"
            },
            "midiChannel": 1,
            "midiNumber": 1
          },
          "encoder": {
            "midiChannel": 1,
            "shiftedMidiChannel": 1,
            "midiNumber": 1,
            "type": {
              "code": 0,
              "name": "note"
            }
          },
          "colors": {
            "active": 43,
            "inactive": 0
          },
          "indicator": {
            "code": 0,
            "name": "dot"
          },
          "superKnobEnabled": false,
          "rawTags": {
            "10": 0,
            "11": 0,
            "12": 0,
            "13": 1,
            "14": 1,
            "15": 0,
            "16": 1,
            "17": 1,
            "18": 0,
            "19": 43,
            "20": 0,
            "21": 64,
            "22": 0,
            "23": 0,
            "24": 1
          }
        },
        {
          "number": 3,
          "detent": {
            "enabled": false,
            "color": 64
          },
          "movement": {
            "code": 0,
            "name": "direct"
          },
          "switch": {
            "action": {
              "code": 0,
              "name": "ccHold"
            },
            "midiChannel": 1,
            "midiNumber": 2
          },
          "encoder": {
            "midiChannel": 1,
            "shiftedMidiChannel": 1,
            "midiNumber": 2,
            "type": {
              "code": 0,
              "name": "note"
            }
          },
          "colors": {
            "active": 43,
            "inactive": 0
          },
          "indicator": {
            "code": 0,
            "name": "dot"
          },
          "superKnobEnabled": false,
          "rawTags": {
            "10": 0,
            "11": 0,
            "12": 0,
            "13": 1,
            "14": 2,
            "15": 0,
            "16": 1,
            "17": 2,
            "18": 0,
            "19": 43,
            "20": 0,
            "21": 64,
            "22": 0,
            "23": 0,
            "24": 1
          }
        },
        {
          "number": 4,
          "detent": {
            "enabled": false,
            "color": 64
          },
          "movement": {
            "code": 0,
            "name": "direct"
          },
          "switch": {
            "action": {
              "code": 0,
              "name": "ccHold"
            },
            "midiChannel": 1,
            "midiNumber": 3
          },
          "encoder": {
            "midiChannel": 1,
            "shiftedMidiChannel": 1,
            "midiNumber": 3,
            "type": {
              "code": 0,
              "name": "note"
            }
          },
          "colors": {
            "active": 43,
            "inactive": 0
          },
          "indicator": {
            "code": 0,
            "name": "dot"
          },
          "superKnobEnabled": false,
          "rawTags": {
            "10": 0,
            "11": 0,
            "12": 0,
            "13": 1,
            "14": 3,
            "15": 0,
            "16": 1,
            "17": 3,
            "18": 0,
            "19": 43,
            "20": 0,
            "21": 64,
            "22": 0,
            "23": 0,
            "24": 1
          }
        },
        {
          "number": 5,
          "detent": {
            "enabled": false,
            "color": 64
          },
          "movement": {
            "code": 0,
            "name": "direct"
          },
          "switch": {
            "action": {
              "code": 0,
              "name": "ccHold"
            },
            "midiChannel": 1,
            "midiNumber": 4
          },
          "encoder": {
            "midiChannel": 1,
            "shiftedMidiChannel": 1,
            "midiNumber": 4,
            "type": {
              "code": 0,
              "name": "note"
            }
          },
          "colors": {
            "active": 43,
            "inactive": 0
          },
          "indicator": {
            "code": 0,
            "name": "dot"
          },
          "superKnobEnabled": false,
          "rawTags": {
            "10": 0,
            "11": 0,
            "12": 0,
            "13": 1,
            "14": 4,
            "15": 0,
            "16": 1,
            "17": 4,
            "18": 0,
            "19": 43,
            "20": 0,
            "21": 64,
            "22": 0,
            "23": 0,
            "24": 1
          }
        },
        {
          "number": 6,
          "detent": {
            "enabled": false,
            "color": 64
          },
          "movement": {
            "code": 0,
            "name": "direct"
          },
          "switch": {
            "action": {
              "code": 0,
              "name": "ccHold"
            },
            "midiChannel": 1,
            "midiNumber": 5
          },
          "encoder": {
            "midiChannel": 1,
            "shiftedMidiChannel": 1,
            "midiNumber": 5,
            "type": {
              "code": 0,
              "name": "note"
            }
          },
          "colors": {
            "active": 43,
            "inactive": 0
          },
          "indicator": {
            "code": 0,
            "name": "dot"
          },
          "superKnobEnabled": false,
          "rawTags": {
            "10": 0,
            "11": 0,
            "12": 0,
            "13": 1,
            "14": 5,
            "15": 0,
            "16": 1,
            "17": 5,
            "18": 0,
            "19": 43,
            "20": 0,
            "21": 64,
            "22": 0,
            "23": 0,
            "24": 1
          }
        },
        {
          "number": 7,
          "detent": {
            "enabled": false,
            "color": 64
          },
          "movement": {
            "code": 0,
            "name": "direct"
          },
          "switch": {
            "action": {
              "code": 0,
              "name": "ccHold"
            },
            "midiChannel": 1,
            "midiNumber": 6
          },
          "encoder": {
            "midiChannel": 1,
            "shiftedMidiChannel": 1,
            "midiNumber": 6,
            "type": {
              "code": 0,
              "name": "note"
            }